nct_id,brief_title,official_title,brief_summary,detailed_description,overall_status,why_stopped,start_date,completion_date,primary_completion_date,study_type,phases,allocation,intervention_model,masking,primary_purpose,enrollment_count,enrollment_type
NCT02662894,Fixed-dose Combination of Valsartan + Rosuvastatin Versus Their Isolated Components for Hypertension and Dyslipidemia.,Efficacy of Fixed-dose Combination of Valsartan + Rosuvastatin Versus Their Isolated Components for Hypertension and Dyslipidemia.,Noninferiority trial to assess efficacy of fixed-dose combination of valsartan + rosuvastatin versus their isolated components in treatment of hypertension and dyslipidemia.,"* Open-label,randomized, multicenter;
* Maximal experiment duration: 8 weeks;
* 04 visits;
* Safety and efficacy evaluation",WITHDRAWN,Sponsor decision,2019-10,2020-12,2020-09,INTERVENTIONAL,PHASE3,RANDOMIZED,PARALLEL,NONE,TREATMENT,0,ACTUAL
NCT00185094,"A Comparison of the Effect of Olmesartan Medoxomil, Losartan Potassium, and Atenolol on the Ability of Overweight Patients With High Blood Pressure to Respond to Insulin","The Effects of Olmesartan Medoxomil, Losartan Potassium, and Atenolol on Insulin Sensitivity in Overweight and Obese Subjects With Hypertension",To examine the effect of three different blood pressure medications on the insulin sensitivity in overweight patients with high blood pressure.,,COMPLETED,,2004-02,2005-07,,INTERVENTIONAL,PHASE4,RANDOMIZED,PARALLEL,NONE,TREATMENT,60,
NCT06543394,Engaging Patients in Adherence Interventions Using Behavioral Science,Optimizing Recruitment Methodology for Medication Adherence Interventions: The ENGaging Patients in Adherence Interventions UsinG Behavioral SciencE (ENGAGE) Randomized Factorial Trial,"The overarching goal of the proposed research is to prepare an evidence-based clinical pharmacist-delivered medication adherence intervention for sustainable implementation and dissemination. Because the effectiveness of the intervention has already been demonstrated in a NIH Stage Model Stage 4 trial called STIC2IT, this study will include an NIH Stage Model Stage 5 Effectiveness-Implementation Type 3 Hybrid design, in which the primary focus is on testing different implementation methods, while secondarily observing clinical effects. The overarching hypothesis is that investigators can identify the most impactful elements of a behavioral theory-informed recruitment approach, which can be replicable across clinical settings.

Accordingly, this study will perform testing of behaviorally-informed recruitment approaches in a primary care setting that serves patients from under-resourced communities. Patients will be English or Spanish speaking adults ≥18 years of age identified through the electronic health record (EHR) as having a primary care clinician at the participating practice as well as uncontrolled hypertension and suboptimal adherence to blood pressure medications based on pharmacy fill data linked to the electronic health record (EHR). The primary care clinicians of eligible patients identified through the EHR will have the opportunity to opt-out any patients they wish not to be included. Patients will then be randomized to each of the following conditions, such that there will be 8 total arms: (1) inclusion of a mailer primer (yes/no), (2) the most successful recruitment letter from a preliminary study using prospect theory (versus the control letter), and (3) intensity of the intervention outreach (up to 4 calls vs. up to 2 calls).

Patients across all arms who agree to be scheduled will receive an appointment with one of the clinical pharmacists trained in the brief negotiated interviewing approach used in the STIC2IT trial. The primary outcome will be completion of a clinical pharmacist appointment within 12 weeks of randomization. Key secondary outcomes will include scheduled visit rates, no-show rates for scheduled appointments, pharmacy fill adherence to statins and blood pressure medications over the 3-month follow-up, and clinical outcomes, including blood pressure as per EHR data in the 3 months after randomization.","Participants will be recruited from Columbia University Irving Medical Center (CUIMC)-affiliated primary care clinics that are part of the New York Presbyterian (NYP) Ambulatory Care Network (ACN). These clinics provide care to patients in the catchment area of CUIMC which is notable for substantial racial, ethnic, and economic diversity. The study team will identify participants with uncontrolled hypertension (last office BP \<140/90 mmHg) who also are nonadherent (PDC\<80%) to at least one antihypertensive medication class and meet other study eligibility criteria.

Participants will then be randomized using a 2\^3 factorial approach to each of the following conditions, such that there will be 8 total arms: (1) inclusion of a mailer primer (yes vs no), (2) a behavioral theory-informed letter script (vs usual scripted letter), and (3) intensity of the recruitment outreach (up to 4 calls vs up to 2 calls). Recruitment outreach will be conducted by members of the study team, who will be trained to deliver different interventions based on a patient's assigned arm. Enrollment will be staggered over an approximately 4-month period so as not to overwhelm the scheduling staff and mimic how quality improvement programs are conducted in typical practice.

Participants who agree to participate in the adherence counseling session after receiving any of the 8 combinations of recruitment strategies will be scheduled to receive a brief evidence-based medication adherence counseling session known as brief negotiated interviewing. Patients who schedule a counseling session with a clinical pharmacist will receive a reminder call before their appointment. This will involve a 30-minute or less telephone or video visit with a nurse or clinical pharmacist who will use a semi-structured guide to confirm the patient's treatment regimen, engage them in sharing potential barriers to adherence or other factors that may be contributing to poor disease control, discuss their readiness to modify behaviors, and work with the patient to develop a shared plan.

The study will concurrently test whether 1) inclusion of a mailed primer is better than no inclusion, 2) whether use of a behavioral theory-informed message-framing strategy in the recruitment letter is better than the usual approach that does not include theory-informed message framing in a recruitment letter, and 3) whether increasing the intensity of recruitment outreach after the letter through up to 4 phone calls is better than up to 2 phone calls. The primary outcome for the study will be whether or not patients completed the adherence counseling session within 12 weeks of randomization. The secondary outcome will be whether patients agreed to have the counseling session scheduled. Exploratory outcomes will include the effects on medication adherence, blood pressure, and LDL cholesterol 3 months after randomization.",ACTIVE_NOT_RECRUITING,,2024-11-08,2026-06-30,2026-05-30,INTERVENTIONAL,NA,RANDOMIZED,FACTORIAL,DOUBLE,HEALTH_SERVICES_RESEARCH,584,ESTIMATED
NCT00942994,Aliskiren/Amlodipine/Hydrochlorothiazide (HCTZ) Versus Aliskiren/Amlodipine in US Minority Patients With Stage II Systolic Hypertension,"An 8-week Multicenter, Randomized, Double-blind, Active Controlled, Parallel Group, Forced Titration Study to Evaluate the Efficacy and Safety of Aliskiren/Amlodipine/HCTZ Compared to Aliskiren/Amlodipine in US Minority Patients With Stage 2 Hypertension","The purpose of the study is to compare the combination of aliskiren, amlodipine and Hydrochlorothiazide (HCTZ) versus the combination of aliskiren and amlodipine as therapy in minority Stage 2 hypertensive patients.",,COMPLETED,,2009-06,,2010-03,INTERVENTIONAL,PHASE4,RANDOMIZED,PARALLEL,DOUBLE,TREATMENT,412,ACTUAL
NCT00409760,Safety and Efficacy of Valsartan and Amlodipine Combined and Alone in Patients With Hypertension.,"A Randomized, Double-blind, Multicenter, Multifactorial, Placebo-controlled, Parallel Group Study to Evaluate the Efficacy and Safety of Valsartan and Amlodipine Combined and Alone in Hypertensive Patients.","This trial will compare valsartan and amlodipine combination therapies to both valsartan and amlodipine, and placebo for the treatment of hypertension.",,COMPLETED,,2003-01,2004-02,2004-02,INTERVENTIONAL,PHASE3,RANDOMIZED,PARALLEL,DOUBLE,TREATMENT,1930,ACTUAL
NCT05159960,Optimal Treatment Protocol for Selective Laser Trabeculoplasty - Repeat Trial,Optimal Treatment Protocol for Selective Laser Trabeculoplasty - Repeat Trial,"Glaucoma is a common eye disease that can lead to blindness. The only known way to reduce the rate of disease progression is by reducing the pressure in the eye (the intraocular pressure, IOP). Selective laser trabeculoplasty (SLT) is an ophthalmic laser intervention with the purpose of reducing the IOP.

SLT can be performed in different ways, with four of the treatment protocols being evaluated in the Optimal SLT (OSLT) trial.

SLT is a repeatable procedure, but scientific evidence is scarce regarding more than one repetition. In this trial, patients included in the OSLT trial will be invited to the extended trial (OSLT-R), for further follow-up and re-treatment with SLT, if needed.","Subjects already included in the OSLT trial (NCT03798223) will be invited to the extended trial (OSLT-R) at the time of SLT re-treatment or when OSLT follow up is scheduled to terminate. Patients are re-treated as needed, according to the randomized group assignment performed in the OSLT inclusion process.

The OSLT-R trial is aiming to elucidate:

* If the SLT efficacy, in terms of relative IOP reduction (percent of baseline IOP), changes with additional SLT iterations.
* If the longevity of IOP reduction after SLT changes with additional SLT iterations.
* If repeated SLT is associated with a change in postoperative discomfort or adverse events.

All of the above will be analyzed within each of the four treatment groups (SLT protocols) in the trial. Further, analysis will also be conducted regarding differences between the treatment groups regarding the above.

Further, analysis will be performed regarding SLT efficacy depending of the total number of SLT:s an eye has received, including those performed before entering the OSLT and OSLT-R trials.",ENROLLING_BY_INVITATION,,2022-01-10,2027-12-31,2027-12-31,INTERVENTIONAL,NA,RANDOMIZED,PARALLEL,DOUBLE,TREATMENT,400,ESTIMATED
NCT00919360,Gene Expression In Pregnancies Complicated by Preeclampsia,Expression of Vascular Endothelial Growth Factor and Its Effectors in Preeclampsia,"The purpose of this study is to figure out some of the differences in bodily function between women who have preeclampsia and those who do not.

* This may eventually lead to an understanding of its cause. At this time, there is no known way to prevent preeclampsia, and the cause is not known.
* The only treatment is delivery of the baby, even if it is premature, in order to decrease the risk to the mother.","* Preeclampsia is a pregnancy-related disorder that occurs in about 6% of all pregnancies.
* In its mild for, preeclampsia involves high blood pressure. More severe forms of preeclampsia can lead to more serious pregnancy complications.
* At this time, there is no known way to prevent preeclampsia, and the cause is not known. The only treatment is delivery of the baby, even if it is premature, in order to decrease the risk to the mother.
* The purpose of this study is to figure out some of the differences in bodily function between women who have preeclampsia and those who do not. This may eventually lead to an understanding of its cause.",TERMINATED,"PI is no longer at University of Rochester, has moved to University of Florida, Gainesville. PI email now homonq@ufl.edu. Phone is 352-273-7675",2008-06,2015-07,2015-07,OBSERVATIONAL,,,,,,125,ACTUAL
NCT03961360,Effectiveness of Higher Aspirin Dosing for Prevention of Preeclampsia in High Risk Obese Gravida,"Effectiveness of Higher Aspirin Dosing for Prevention of Preeclampsia in High Risk Obese Gravida: An Open Label, Comparative Effectiveness, Randomized Controlled Trial (ASPREO Trial)",To compare the incidence of preeclampsia in obese pregnant women (BMI greater than 30) with a singleton gestation at less than 20 weeks and either a history of preeclampsia in a prior pregnancy or stage I hypertension or pre-gestational diabetes who are randomized to either 81mg/day aspirin or 162mg/day aspirin.,,COMPLETED,,2019-05-06,2023-04-10,2023-04-10,INTERVENTIONAL,PHASE2|PHASE3,RANDOMIZED,PARALLEL,NONE,TREATMENT,220,ACTUAL
NCT01451060,Maternal and Neonatal Outcomes of the Use of Vasopressors to Treat Hypotension During Spinal Anesthesia for Cesarean,Maternal and Neonatal Outcomes After the Use of Vasopressors to Correct Hypotension During Cesarean Section Under Spinal Anesthesia in Pregnant Women With Severe Preeclampsia: Randomized Clinical Trial,"Anesthesia for cesarean section has been a great challenge for the anesthesiologist, for mother and fetus are closely related. So the challenge is to anesthetize the mother without interfering with the physiology of the fetus. The spinal block, although safe, are not free of complications if not treated properly, may be responsible for increased fetal morbidity. Among the major side effects, there is hypotension, with potentially serious consequences for the maternal-fetal dyad. Hypotension in pregnant women at low risk may not lead to major damage, but a pregnant woman with low reserves, as is the case of pregnant women with pre-eclampsia, any drop in blood pressure of the mother can bring harm to the welfare of mother and fetus. Based on the above, the purpose of this study is to compare the effects of maternal and perinatal treatment of hypotension with ephedrine or metaraminol in pregnant women with severe preeclampsia undergoing cesarean section under spinal anesthesia. There will be a randomized, double-blind, which will be included pregnant women with severe preeclampsia with indication of cesarean section, gestational age above 34 weeks gestation and only.Will be Excluded women with hemorrhagic syndromes of pregnancy, HELLP syndrome, eclampsia, cardiovascular or cerebrovascular disease, fetal distress and absolute contraindications to spinal anesthesia.

All patients are fully informed of the research objectives and will only be included in the study if they agree to participate and sign the Instrument of Consent. The project was designed following the recommendations of Resolution 196/96 of the National Health and the Declaration of Helsinki for research involving human subjects (2000). In addition, the project was submitted to the Ethics Committee in Research of the Institute of Integrative Medicine Professor Fernando Figueira, is approved. The study will be conducted from June 2011 to July 2012. The study variables are: consumption of metaraminol and ephedrine before and after birth, the occurrence of nausea and vomiting, incidence of maternal hypotension, the occurrence of reactive hypertension, occurrence of bradycardia, pH of umbilical cord, Apgar score 5 minutes, need for face mask ventilation and ICU admission.","Ephedrine, a long time was considered the safest drug for both mother and fetus during the treatment of hypotension in Caesarean section. However, recent evidence shows that contrary to what was thought, ephedrine appears to increase fetal metabolism, decreasing the pH and excess base.

Recently, phenylephrine has been used in the treatment of hypotension during cesarean delivery with better results in relation to acid-base parameters in umbilical cord blood. However, few data are available on the use of phenylephrine in high-risk pregnancy, the majority of studies in healthy pregnant women for elective caesarean section.

Although little scientific evidence regarding the use of metaraminol for treatment of hypotension in Caesarean section, recent study demonstrated superiority of this drug compared to ephedrine, checking a lower incidence of neonatal acidosis and better control of blood pressure. The researchers also found differences in blood gases from the umbilical cord between the ephedrine and metaraminol groups larger than those already found in previous studies comparing ephedrine and phenylephrine.

The pathophysiological changes in patients with pre-eclampsia can lead to intrauterine growth restriction with chronic fetal distress, due to the limited uteroplacental flow, which, in certain situations, may be reduced by 50% to 70%. Added to this, spinal anesthesia may cause sudden hypotension and fetal acidosis more often, even in elective operations, compared to epidural or general anesthesia, and that these changes may not have clinical significance in healthy fetuses at term, but may be critical in situations where arterial insufficiency uteroplacental and fetal distress already to present. It is believed, therefore, important that treat or prevent hypotension in patients with severe preeclampsia under spinal anesthesia.

Prevention of hypotension in patients with severe preeclampsia does not require large amounts of intravenous fluids, but careful prophylaxis of postural hypotensive syndrome. Despite the care, if hypotension occurs, aggressive treatment is mandatory in these patients and fast in order to avoid worsening fetal distress and neonatal depression. Such patients are more sensitive to vasopressors, therefore, small doses should be administered.

However, the biggest challenge of the anesthesiologist is to determine the ideal vasopressor in pregnant women at high risk, able to adequately restore blood pressure levels without determining deterioration of fetal status.

30 Reynolds and Seed in 2005 showed that ephedrine, administered in large doses, has contributed to the adverse effects of spinal anesthesia (greater degree of fetal metabolic acidosis), supporting the idea that ephedrine is not the vasopressor of choice for treatment of maternal hypotension during cesarean section.

As a result, this study is to fill this knowledge gap, taking on great importance to evaluate maternal and perinatal outcomes of pregnant women with severe preeclampsia to receive ephedrine or metaraminol for treatment of maternal hypotension during caesarean section under spinal anesthesia. Considering the importance of creating a protocol, since the metaraminol, unlike phenylephrine, is widely available at our facility.",WITHDRAWN,We didn't have enough financial support,2011-06,2014-07,2014-06,INTERVENTIONAL,PHASE3,RANDOMIZED,SINGLE_GROUP,DOUBLE,TREATMENT,0,ACTUAL
NCT00001176,Effects of Salt Intake on the Nervous Systems of Patients With Salt-Sensitive High Blood Pressure,The Function of Dopaminergic and Noradrenergic Systems in Salt-Sensitive Hypertension: The Effects of Changes in Sodium Intake,"Some patients with high blood pressure can experience an increase of blood pressure by 10 percent or more by taking in salt. These patients are referred to as having ""salt-sensitive"" (SS) hypertension.

Previous studies conducted on patients with salt sensitive hypertension suggest that their portion of the nervous system responsible for maintaining normal blood pressure (autonomic nervous system) may respond differently to salt than patients with non-salt sensitive (NSS) hypertension.

This study is designed to examine the response of the nervous system to high doses of salt in patients with salt-sensitive hypertension and patients with non-salt sensitive hypertension.","A subset of patients with idiopathic hypertension shows an increase in blood pressure of 10 percent or more in response to salt-loading and have been termed ""salt-sensitive"" (SS). Limited studies of adrenergic function in response to salt-loading suggest that the response of SS patients may differ from that of non-salt sensitive (NSS) patients. The present studies were designed to examine the response of the adrenergic and dopaminergic systems to salt-loading in SS and NSS patients with idiopathic hypertension.",COMPLETED,,1981-05,2001-12,,OBSERVATIONAL,,,,,,110,
NCT04698876,Self Tonometry and Transfer of Glaucoma Patients' Data for Improving the Supply Situation,SALUS - Selbsttonometrie Und Datentransfer Bei Glaukompatienten Zur Verbesserung Der Versorgungssituation,"The SALUS project is developing a new form of care, the application of self-tonometry by the patient itself, and an accompanying electronic case file connecting clinics, doctor's offices and patients.","The SALUS project is developing an outpatient, intersectoral form of care in which patients measure their intraocular pressure in their home environment with a so-called self-tonometer. The measured intraocular pressure values are incorporated into daily pressure profiles, which can be viewed via an electronic case file together with further examination data both by the treating ophthalmologists in the doctor's offices and clinics and by the patients. The new form of care not only supports the telemedical networking of doctors but also increases the compliance by involving the patient in the entire course of the illness.",COMPLETED,,2021-02-11,2023-11-30,2023-10-31,INTERVENTIONAL,NA,RANDOMIZED,PARALLEL,NONE,HEALTH_SERVICES_RESEARCH,267,ACTUAL
NCT04354376,Replication of the TRANSCEND Antihypertensive Trial in Healthcare Claims Data,Replication of the TRANSCEND Antihypertensive Trial in Healthcare Claims Data,Investigators are building an empirical evidence base for real world data through large-scale replication of randomized controlled trials. The investigators' goal is to understand for what types of clinical questions real world data analyses can be conducted with confidence and how to implement such studies.,"This is a non-randomized, non-interventional study that is part of the RCT DUPLICATE initiative (www.rctduplicate.org) of the Brigham and Women's Hospital, Harvard Medical School. It is intended to replicate, as closely as is possible in healthcare insurance claims data, the trial listed below/above. Although many features of the trial cannot be directly replicated in healthcare claims, key design features, including outcomes, exposures, and inclusion/exclusion criteria, were selected to proxy those features from the trial. Randomization is also not replicable in healthcare claims data but was proxied through a statistical balancing of measured covariates according to standard practice. Investigators assume that the RCT provides the reference standard treatment effect estimate and that failure to replicate RCT findings is indicative of the inadequacy of the healthcare claims data for replication for a range of possible reasons and does not provide information on the validity of the original RCT finding.",COMPLETED,,2017-09-22,2021-02-08,2021-02-08,OBSERVATIONAL,,,,,,40048,ACTUAL
NCT00372827,Study of Brinzolamide and Timolol When Added to Travoprost in Primary Open-angle Glaucoma or Ocular Hypertension,Efficacy and Safety of Timolol Maleate 0.5% Compared to Brinzolamide 1% When Added to Travoprost 0.004% in Primary Open-angle Glaucoma or Ocular Hypertension,The purpose of the study is to compare the efficacy and safety of Timolol 0.5% solution to Brinzolamide 1% each given twice daily when added to Travoprost 0.004% given each evening.,,COMPLETED,,2004-02,2006-01,2006-01,INTERVENTIONAL,PHASE4,RANDOMIZED,PARALLEL,DOUBLE,TREATMENT,245,
NCT00963027,Effect of Esomeprazole on the Pharmacokinetics of Oral Treprostinil,An Evaluation of Single Dose UT-15C SR (Treprostinil Diethanolamine) Pharmacokinetics Following Repeated Dosing With the Proton Pump Inhibitor Esomeprazole in Healthy Adult Volunteers,"The purpose of this study is to evaluate the effect of esomeprazole, a proton pump inhibitor, on treprostinil pharmacokinetics.","This open-label study will evaluate the effect of esomeprazole, a proton pump inhibitor, on treprostinil pharmacokinetics following a single 1 mg oral dose of UT-15C SR in healthy volunteers.",COMPLETED,,2009-09,2009-10,2009-10,INTERVENTIONAL,PHASE1,,CROSSOVER,NONE,TREATMENT,30,ESTIMATED
NCT01527760,Effectiveness of Viscum Album Mother Tincture as an Anti-hypertensive in Essential Hypertension,Effectiveness of Viscum Album Mother Tincture as an Anti-hypertensive in Essential Hypertension. One Group Pretest Posttest Design,To estimate the effectiveness of Viscum album Homoeopathic mother tincture in Essential Hypertension by conducting clinical trial in moderate hypertensive patients for a period of six weeks.,,COMPLETED,,2011-02,2011-09,2011-08,INTERVENTIONAL,NA,NA,SINGLE_GROUP,NONE,TREATMENT,37,ACTUAL
NCT01096160,"A Study to Evaluate the Safety, Tolerability, Pharmacokinetics and Pharmacodynamics of MK8266 in Hypertensive Men (MK-8266-002)","A Multiple Dose Study to Evaluate the Safety, Tolerability, Pharmacokinetics and Pharmacodynamics of MK-8266","This study evaluated adverse events (AEs), study discontinuation due to AEs, and pharmacodynamics of MK-8266 in male participants with mild to moderate hypertension.","This study evaluated AEs, discontinuation due to AEs, and effects on hemodynamic parameters, including systolic blood pressure (SBP) and aortic augmentation index (AIx), following multiple oral doses of MK-8266. Five serial panels, each consisting of eight participants (40 participants in Panels A, B, C, D, and E), were randomized to receive either MK-8266 or matching placebo twice daily (BID) or three times daily (TID) for 10 consecutive days. Although the original plan was to evaluate MK-8266 treatment in Panels D and E using both BID and TID regimens, the study actually evaluated identical TID regimens in these panels.",COMPLETED,,2010-03-01,2010-11-01,2010-11-01,INTERVENTIONAL,PHASE1,RANDOMIZED,SEQUENTIAL,DOUBLE,TREATMENT,40,ACTUAL
