nct_id,brief_title,official_title,brief_summary,detailed_description,overall_status,why_stopped,start_date,completion_date,primary_completion_date,study_type,phases,allocation,intervention_model,masking,primary_purpose,enrollment_count,enrollment_type
NCT06303830,Bariatric Surgery and Cardiovascular Responses to Sodium Nitrate,Changes Induced by Bariatric Surgery in Cardiovascular Responses to Dietary Supplementation With Sodium Nitrate,"Inorganic nitrite and nitrate can be reduced to NO and NO-related species such as S-nitrosothiols via the nitrate-nitrite-NO pathway. This is due to the reduction of nitrate to nitrite by the action of bacteria in the mouth and the reduction of nitrite to NO depending on the acidic pH on the stomach or by enzymes with nitrite-reductase activity. The acidic environment of the stomach is very important to the formation of NO and S-nitrosothiols and several studies suggest that changes in gastric pH can affect this conversion. In this context, bariatric surgery, by altering the anatomy of the stomach and increasing gastric pH, can affect the nitrate-nitrite-NO pathway and change the antihypertensive and antioxidant effect of sodium nitrate.",,COMPLETED,,2019-04-16,2021-10-01,2020-12-17,INTERVENTIONAL,NA,NON_RANDOMIZED,PARALLEL,NONE,TREATMENT,30,ACTUAL
NCT00573430,ARIA (Atacand Renoprotection In NephropAthy Pt.),"A 28-week, Randomised, Open-label, Parallel-Group, Multi-Center Study To Find the Effective Dose of Candesartan Cilexetil (Atacand) for Renoprotection in Korean Hypertensive Patients With Non-diabetic Nephropathy","To determine the effective dose of candesartan cilexetil for reduction of urinary protein excretion in hypertensive patients with non-diabetic chronic kidney disease with baseline urinary protein/creatinine ratio between 500mg/g and 5000mg/g, by assessing the change in urinary protein/creatinine ratio from baseline to the end of 28-week treatment",,COMPLETED,,2007-12,2009-08,2009-08,INTERVENTIONAL,PHASE4,RANDOMIZED,PARALLEL,NONE,TREATMENT,128,ACTUAL
NCT05680025,Effect of a Physical Exercise Intervention Based on the Transtheoretical Model on Blood Pressure,"Effect of a Physical Exercise Intervention Based on the Transtheoretical Model, on Blood Pressure in Patients With Hypertension, Insured by Mexican Institute of Social Security, in the State of Aguascalientes","Background: Hypertension is a public health problem; the World Health Organization (WHO) estimates that more than 1280 million people suffer it. The treatment of said condition is pharmacological and non-pharmacological. Physical activity is part of the treatment, but unfortunately few adults can be classified as physically active. There is evidence that performing physical exercise reduces systolic blood pressure by up to 5 mm Hg, which has associated with reduced heart disease by up to 9%, ictus up to 14% and all-cause mortality by 4%. Lifestyle changing interventions, among them promoting exercise marked by a theory of behavior change, have shown positive results. Objective: To evaluate the effect of an intervention promoting the performance of physical exercise, with specific recommendations, based on the Transtheoretical Model, on systolic blood pressure and on the amount of exercise performed (minutes/week) in patients with hypertension aged 40 to 70 years, users of primary care in the Mexican Institute for Social Security (IMSS) in Aguascalientes. Material and methods: Randomized clinical trial, in which 442 patients with hypertension will participate. The control group will receive conventional care and recommendations for physical exercise and diet. The intervention group, in addition, will attend 6 workshops, one a month, which will promote performing physical exercise, with access given to videos of physical exercise routines, designed to gradually increase the exercise performed. At the start and end of the study, blood pressure, anthropometric measurements will be taken, through a questionnaire asking about sociodemographic data, performance of physical exercise, psychosocial factors regarding physical exercise, diet and adherence to pharmacological treatment. The characteristics of the study population by group will be described, and changes between baseline and final measurements compared, intra and intergroup, in the systolic blood pressure and minutes/week of physical exercise.",,ENROLLING_BY_INVITATION,,2022-08-08,2024-08-30,2023-12-15,INTERVENTIONAL,NA,RANDOMIZED,PARALLEL,SINGLE,PREVENTION,442,ESTIMATED
NCT04060225,Effects of High Caffeine Content Coffee on Blood Pressure in Young Adults,Short-term and Intermediate-term Effects of High Volume High Caffeine Content Coffee on Blood Pressure in Young Adults,The purpose of this study is to help further the understanding of the effects of commercially available high-caffeine containing coffee on blood pressure in healthy adult subjects.,,TERMINATED,not possible to enroll during COVID pandemic,2019-12-02,2019-12-19,2019-12-19,INTERVENTIONAL,NA,NA,SINGLE_GROUP,NONE,SUPPORTIVE_CARE,1,ACTUAL
NCT04079725,Iris Tissue in Primary Congenital Glaucoma,Histopathological Examination of Iris Tissue in Primary Congenital Glaucoma,To present the histopathological features of the iris tissue in primary congenital glaucoma which may play a role in pathogenesis,"Primary congenital glaucoma etiology still remains obscure . originally barkan , and later Worst , proposed that a membrane covered the anterior chamber angle and blocked aqueous outflow , but the presence of that membrane has not been established histopathologically to date . Now most authors believe that the site of obstruction is the trabecular meshwork rather than an overlying membrane . Maldevelopment of the anterior segment is present in all forms of congenital glaucoma . this maldevelopment may involve the trabecular meshwork alone or the trabecular meshwork in combination with the iris or cornea or both. In approcimately 50% of patients , isolated trabeculodysgensis is the only developmental ocular anomaly found .This is the classic defect found in primary congenital glaucoma .These eyes have no developmental anomalies of iris or cornea present except abnormal insertion of the iris into the angle",UNKNOWN,,2020-12,2022-03,2021-09,INTERVENTIONAL,NA,NA,SINGLE_GROUP,NONE,TREATMENT,15,ESTIMATED
NCT05335122,A Study to Evaluate the Efficacy and Safety of OTX-TIC (Travoprost) Intracameral Implant for Patients With Open-angle Glaucoma (OAG) or Ocular Hypertension (OHT),"A Prospective, Multi-center, Randomized, Parallel-group, Controlled Study to Evaluate the Efficacy and Safety of OTX-TIC (Travoprost) Intracameral Implant in Subjects With Open-angle Glaucoma (OAG) or Ocular Hypertension (OHT)","To assess efficacy, and safety of a single sustained release dose of the OTX-TIC drug product (2 travoprost dose strengths) in subjects with Open Angle Glaucoma (OAG) or Ocular Hypertension (OHT)","This is a prospective, multi-center, randomized, parallel-group, controlled study to evaluate the efficacy, and safety of OTX-TIC (travoprost) intracameral implant in subjects with open angle glaucoma (OAG) or ocular hypertension (OHT). Approximately 105 subjects will be enrolled in this study at approximately 20 sites in the US. Subjects will be a randomized to one of three treatment groups OTX-TIC drug product (2 travoprost dose strengths) compared to a single injection of DurystaTM. Non study eyes will be treated with the PGA, if not contraindicated.",COMPLETED,,2022-03-16,2025-01-24,2024-01-24,INTERVENTIONAL,PHASE2,RANDOMIZED,PARALLEL,DOUBLE,TREATMENT,83,ACTUAL
NCT04306822,Epidemiology of Cardiovascular Diseases and Their Risk Factors in Regions of Russian Federation,Epidemiology of Cardiovascular Diseases and Their Risk Factors in Regions of Russian Federation,"The study carried out in 2012-2014 years. The aim was to evaluate the prevalence of CVD and their RF in different regions of the Russian Federation and to develop epidemiological models of the CVD risk profile for the population based on traditional factors, as well as to assess the contribution of traditional and ""new"" cardiovascular risk factors to the mortality rate of the country's population based on domestic data. Thirteen regions were included. We examined 22,906 males and females, aged 25-64 years. The examination consist of anthropometry; the measurement of BP, resting heart rate, and a 12-lead standard electrocardiography (ECG) in a supine position. The personal interview information was collected using a structured questionnaire, and included socio-demographic and socio-economic measures; health parameters; medical history; stress, and depression. Continued monitoring of mortality, the latest mortality update includes deaths through 2019.","The representative (systematic stratified multistage) random sample was generated according to the territorial principle (Kish method) in 13 regions of the Russian Federation. The study sample included 22,906 participants (8353 males and 13553 females) 25-64 years old, with a response rate - 80%, examined in 2012-2014. The following regions were included: Volgograd, Voronezh, Vologda, Ivanovo, Kemerovo, Orenburg, Samara, Tomsk, Tyumen regions, St. Petersburg, Krasnoyarsk, Primorsky Territory and the Republic of North Ossetia-Alania. All of the subjects were examined using a standard questionnaire consisting of 12 modules and containing information on age and gender composition, educational status, professional affiliation, level of well-being of survey participants, the presence of behavioral risk factors: smoking, excessive alcohol consumption, low physical activity, poor nutrition, as well as anxiety and depressive disorders. In addition, the questionnaire included anamnestic data on chronic diseases and drug therapy. Quality of life was assessed using the EUROQOL international questionnaire - EQ-5D All subjects were measured blood pressure (BP) and heart rate twice according to the standard procedure. Anthropometric procedures included measuring weight (kg), height (m), waist circumference (cm), calculating body mass index (BMI; kg / m2). The lipid profile was determined for all patients, including levels of HDL and HDL cholesterol, triglycerides, as well as glucose, creatinine and uric acid. The levels of these parameters in blood serum were determined by Abbot Architect c8000 biochemical analyzer (USA). The Additional Screening program, included sphygmomanometry, duplex scanning of carotid arteries, and evaluation of the parameters characterizing the functioning of metabolic systems (apo B and apo AI, as well as LP (a), C-reactive protein (hsCRP), NT-proBNP - the N-terminal propeptide of cerebral natriuretic hormone B-type, dash Nootropic hormone (TSH), insulin, D-dimer) in addition to the main survey was conducted in the 5 regions.Continued monitoring of mortality. Deaths were verified in residential registers and from telephone calls. The latest mortality update includes deaths through 2019.",COMPLETED,,2012-01,2020-01,2014-01,OBSERVATIONAL,,,,,,22906,ACTUAL
NCT06133322,Blood Pressure Lowering Strategies to Eliminate Hypertension Disparities (BLESSED),Blood Pressure Lowering Strategies to Eliminate Hypertension Disparities,"The burden of hypertension and related cardiovascular diseases, stroke, and end-stage kidney disease is disproportionately high in Black populations, especially in the South. The Blood Pressure Lowering Strategies to Eliminate Hypertension Disparities (BLESSED) cluster randomized trial aims to test the effectiveness, implementation, and sustainability of a community health worker (CHW)-led multifaceted intervention compared to enhanced usual care for hypertension control in Black communities. In the BLESSED trial, the investigators plan to recruit 1,176 adults with hypertension (approximately 28 per church) from 42 predominantly Black churches in the Greater New Orleans area. The multifaceted intervention will last for 18 months, followed by a post-intervention follow-up visit at 24 months. The BLESSED trial aims to generate evidence regarding the effectiveness, implementation, and sustainability of this CHW-led church-based multifaceted intervention in eliminating hypertension disparities in the United States (US) general population.","Louisiana residents, especially African Americans, bear a disproportionately high burden of hypertension and cardiovascular disease (CVD). In the Blood Pressure Lowering Strategies to Eliminate Hypertension Disparities (BLESSED) cluster randomized trial, the investigators will compare the impact of two implementation strategies - a CHW-led multifaceted strategy and a group-based education strategy - for delivering interventions recommended by the 2017 American College of Cardiology (ACC) and the American Heart Association (AHA) hypertension clinical guidelines on implementation and clinical effectiveness outcomes in predominantly Black community members over 18 months. The BLESSED study utilizes an effectiveness-implementation hybrid design to: (1). test the effectiveness of a CHW-led church-based multifaceted implementation strategy for reducing estimated CVD risk over 18 months among African American church community members at high risk for CVD, and (2). assess the implementation outcomes (acceptability, adaptation, adoption, feasibility, fidelity, penetrance, cost-effectiveness, and sustainability) simultaneously. The Exploration, Preparation, Implementation, Sustainment (EPIS) framework has guided the development and evaluation of the multifaceted implementation strategy, which includes CHW-led health coaching on lifestyle changes and medication adherence; healthcare delivery in community; church-based exercise and weight loss programs; self-monitoring of blood pressure (BP); and provider education and engagement. The CHW-led church-based intervention will provide strong social support and tackle multiple social determinants of CVD disparities. The primary clinical effectiveness outcome is the difference in mean change of systolic blood pressure (SBP) from baseline to 18 months between intervention and control groups. The primary implementation outcome is a fidelity summary score for key implementation strategy components to the CHW-led church-based multifaceted implementation strategy assessed at the participant levels. This study has 90% statistical power to detect group differences in mean SBP change of 5.8 mm Hg over 18 months using a 2-sided significance level of 0.05. The investigators will recruit 1,176 participants (28 per church) who are aged ≥18 years with systolic blood pressure ≥130 mmHg or diastolic blood pressure ≥80 mm Hg, and randomly assign 21 churches to intervention and 21 to control; the investigators will implement the multifaceted intervention program; the investigators will follow-up participants and collect data on effectiveness and implementation outcomes at 6, 12, and 18 months; the investigators will evaluate the sustainability of the intervention at 6 months post-intervention; and the investigators will perform intention-to-treat analyses and disseminate and scale-up the proven-effective implementation strategy. The proposed study will generate evidence on the effectiveness, implementation, and sustainability of the multifaceted intervention aimed at eliminating CVD disparities in African American populations in the US.",RECRUITING,,2023-11-01,2027-06-30,2026-08-31,INTERVENTIONAL,NA,RANDOMIZED,PARALLEL,SINGLE,PREVENTION,1176,ESTIMATED
NCT02822222,Safety Study of RMJH-111b to Treat Essential Hypertension,"A Phase 1/2, Randomized, Double-Blind, Placebo-Controlled Study to Assess the Safety and Tolerability of RMJH-111b in Adult Subjects With Essential Hypertension","The purpose of this study was to evaluate the safety of RMJH-111b, including how well it is tolerated, and the effect of RMJH-111b on blood pressure in subjects with hypertension. The study also measured the amount of magnesium in the blood and urine before and after RMJH-111b administration to evaluate what the body does to RMJH-111b (pharmacokinetics).","This was a phase 1/2, single center, randomized, double-blind, placebo-controlled study to assess the safety and tolerability of RMJH-111b in adult subjects with essential hypertension. Assessments of pharmacokinetics and efficacy were secondary objectives.

RMJ Holdings LLC (doing business as RMJH Rx) is developing RMJH-111b (magnesium citrate, tribasic anhydrous) soft gelatin capsules for the treatment of essential hypertension. The rationale for developing RMJH-111b for essential hypertension is based on reported calcium channel blocker and vasodilator effects of magnesium cation (Mg++). Given this hypothesized mechanism of action, RMJH-111b may not be effective for subjects with other causes or forms of hypertension, and thus the diagnosis of essential hypertension was a key inclusion criterion for this trial.

In order to avoid confounding the results of the trial, subjects who were already taking anti-hypertensive medications to manage their hypertension were taken off of those medications and underwent a 7-day washout period. Subjects that met the specified blood pressure criteria after the washout \[systolic blood pressure (SBP) ≥ 150 and ≤ 200 mmHg and diastolic blood pressure (DBP) ≥ 95 and ≤ 115 mmHg\] received placebo orally twice a day (bid) for a 3-day run-in period (Days 1-3). Subjects that were recently diagnosed or previously diagnosed and off treatment for \> 1 week before starting the study and who met the blood pressure criteria proceeded directly to the 3-day run-in period (i.e., without the 7-day washout period). During the 3-day run-in period, the subjects remained in the clinical research unit (CRU) on a low salt (2.5 g/24 hours) diet.

Subjects that remained eligible after the run-in period were randomized to receive either 440 mg of RMJH-111b or placebo orally bid (i.e., total daily dose of 880 and 0 mg elemental magnesium, respectively) for a 7-day treatment period (Days 4-10). A total of 21 subjects randomized 15:6 to RMJH-111b or placebo was planned. Subjects were randomized on either June 10th or 23rd of 2016. Based on the screen failure rate of the 1st cohort, the number of subjects needed for the 2nd cohort was projected. The actual number of subjects eligible for randomization at the end of the run-in period in the 2nd cohort exceeded the projection by 1 and all eligible subjects were randomized. Thus, the actual number of subjects randomized was 22, with 16 subjects in the RMJH-111b group and 6 subjects in the placebo group (i.e., 16:6 rather than 15:6). Subjects remained in the CRU on a low salt (2.5 g/24 hours) diet for the entire 7-day treatment period and through the 24-hour post treatment assessments (Day 11).

Subjects returned to the clinic 8 days (±3 days) after the last dose of Study Drug (active or placebo) for their Final Study Visit.

Protocol-specified reasons for discontinuing a subject from the study included, but were not limited to: 1) subject's blood pressure was too elevated for them to safely continue in the study (subjects who experienced SBP \>200 mmHg or DBP \>115 mmHg had to have these measurements repeated approximately 1 hour later, and if the SBP or DBP remained elevated, the subject was to be removed from the study and treated accordingly), 2) subject experienced a sharp drop in blood pressure (SBP \< 110 mmHg or DBP \< 60 mmHg); 3) subject's patellar reflex (knee jerk) disappeared, and 4) subject's total serum magnesium levels increased to ≥ 5 mg/dL (twice the upper limit of normal). As a conservative measure for this first trial of RMJH-111b, the criterion regarding drop in blood pressure did not require any associated clinical symptoms. For the pivotal trial, RMJH Rx will incorporate orthostatic hypotension monitoring and refine the discontinuation criterion regarding drop in blood pressure to allow for continued Study Drug treatment in the absence of clinical symptoms, so as to avoid unnecessarily removing a subject that is experiencing therapeutic benefit.

All measurements used for the safety assessments in this study are widely used, and generally recognized as reliable, accurate, and relevant. Further, they included standard parameters used in the evaluation of drugs with the potential for anti-hypertensive and magnesium toxicity effects.

Because blood pressure varies at daytime compared to nighttime, mean daytime (8 AM to 4 PM), nighttime (10 PM to 6 AM), and 24-hour ambulatory blood pressure monitor (ABPM) parameters were used to assess the efficacy effects of RMJH-111b on blood pressure in this trial. While 24-hour ambulatory blood pressure monitoring is considered as a more precise method for the evaluation of drug effects on blood pressure than clinic visit (seated) blood pressures, this trial also included efficacy evaluations of seated SBP and DBP parameters for informational purposes and in particular to facilitate the design of the larger pivotal trial where ABPM monitoring will not be practical.

The pharmacokinetic (PK) evaluation of magnesium is complicated by pre-existing endogenous levels of magnesium, other ingested sources of magnesium (daily diet and supplements; supplements with total daily dose of magnesium ≤ 150 mg were allowed in this study), and the tight regulation of magnesium in the body (magnesium homeostasis) with relatively high levels of magnesium in bones and soft tissues compared to approximately 1% in the blood. Thus, the total serum magnesium exposure was anticipated to be minimally effected with RMJH-111b intake, but evidence of urinary magnesium excretion coupled with maintained total serum magnesium exposure was expected to provide an indication of intake rather than magnesium wasting.",COMPLETED,,2016-06-10,2016-07-07,2016-07-07,INTERVENTIONAL,PHASE1|PHASE2,RANDOMIZED,PARALLEL,TRIPLE,TREATMENT,22,ACTUAL
NCT02516722,TReatment Of Pulmonary HYpertension 1 Study,Clinical Evaluation of the Therapeutic Intra-Vascular Ultrasound (TIVUS™) System for Pulmonary Artery Denervation (PDN) in Patients With Pulmonary Hypertension,"The objective of this study is to assess the safety, performance and initial effectiveness of the TIVUS™ System when used for pulmonary artery denervation through subjective and objective change in clinical parameters and haemodynamic evaluation. This is a prospective, multi-center, non-randomized, open-label clinical trail. The study will be conducted in up to 5 centers and will recruit up to 15 patients diagnosed with PAH, functional class III who have stable PAH on a stable drug regimen of two pulmonary arterial hypertension specific medications.",,UNKNOWN,,2016-02,2021-06,2018-10,INTERVENTIONAL,NA,NA,SINGLE_GROUP,NONE,TREATMENT,15,ESTIMATED
NCT00313222,Bosentan Effects in Inoperable Forms of Chronic Thromboembolic Pulmonary Hypertension,"Prospective, Randomized, Placebo-controlled, Double-blind, Multicenter, Parallel Group Study to Assess the Efficacy, Safety and Tolerability of Bosentan in Patients With Inoperable Chronic Thromboembolic Pulmonary Hypertension (CTEPH)","The present trial investigates a possible use of oral bosentan, which is currently approved for the treatment of symptoms of pulmonary arterial hypertension (PAH), to patients suffering from inoperable chronic thromboembolic pulmonary hypertension (CTEPH) because of (i) peripheral localization of thrombotic material or (ii) persistent or recurrent pulmonary hypertension after pulmonary endarterectomy.",,COMPLETED,,2005-10,2007-03,2007-02,INTERVENTIONAL,PHASE3,RANDOMIZED,PARALLEL,DOUBLE,TREATMENT,157,ACTUAL
NCT01071122,FOCUS (Nifedipine GITS's Effect on Central Pressure Assessed by Applanation Tonometry),"A Prospective, Open-label, Active-controlled, Randomized Study Comparing Nifedipine GITS Versus Valsartan Versus a Combination of Both on Central Blood Pressure in Inadequately Controlled Essential Hypertension.","To determine whether the combination of nifedipine GITS and valsartan is more effective in reducing central blood pressure than nifedipine GITS or valsartan alone, and to determine whether nifedipine GITS is comparable to valsartan",,COMPLETED,,2010-01,2012-02,2012-02,INTERVENTIONAL,PHASE4,RANDOMIZED,PARALLEL,NONE,TREATMENT,365,ACTUAL
NCT01669525,Placental Growth and Adverse Pregnancy Outcomes,Placental Growth and Maternal Serum Biomarkers in the Prediction of Adverse Pregnancy Outcome,The purpose of this study to determine if measurement of maternal serum biomarkers and evaluation of the placenta by ultrasound can improve prediction of adverse pregnancy outcomes.,"The placenta is known to play a vital role in maintaining a healthy pregnancy. Placental dysfunction is believed to be a driving factor in a variety of adverse obstetric outcomes, including fetal growth restriction and preeclampsia. Advances in 3D ultrasound have allowed for measurement of placental volumes during pregnancy. It may be that quantitative assessment of early placental growth can help identify pregnancies at risk for adverse outcome. Furthermore, various novel serum analytes have been proposed as predictors of adverse outcome. The investigators seek to prospectively measure placental volume and diameter at 11-14 weeks and 18-24 weeks to determine if placental growth can predict adverse outcome. In addition, the investigators seek to investigate the relationship between placental growth and serum levels of various biomarkers to see if improved detection of adverse outcome can be achieved.",COMPLETED,,2009-11,2016-06,2016-06,OBSERVATIONAL,,,,,,1043,ACTUAL
