nct_id,brief_title,official_title,brief_summary,detailed_description,overall_status,why_stopped,start_date,completion_date,primary_completion_date,study_type,phases,allocation,intervention_model,masking,primary_purpose,enrollment_count,enrollment_type
NCT05363748,Renal Artery Fibromuscular Dysplasia Registry,A Prospective Study of the Renal Artery Fibromuscular Dysplasia Registry in China,"1. Study name: A Prospective Study of the Renal artery fibromuscular dysplasia Registry in China
2. Rationale: Fibromuscular dysplasia (FMD) is an idiopathic systemic noninflammatory arterial disease resulting in narrowing of medium-sized arteries. Renal arteries are most commonly involved vessels, although it can also affect arteries in other vascular territories. Renal artery FMD is the second frequent cause of renovascular hypertension , especially in adolescents. The pathogenesis of FMD is still not understood. There were little Asians in the United States and the European/International FMD registry.
3. Objective: 1) To describe the characteristics of renal artery FMD; 2) To identify environmental/ hormonal factors and exposures (for example smoking) associated with the onset and progression of renal artery FMD; 3)To identify baseline characteristics of the disease associated with an increased risk of complications such as dissections, aneurysms, stroke or myocardial infarction; 4) To provide evidence-based algorithms for the management and follow-up of patients with renal artery FMD; 5) To establish a comprehensive imaging resource including a wide range of presentations of renal artery FMD.
4. Study design: Prospective, multi-center, observational study.
5. Study population: renal artery fibromuscular dysplasia
6. Data Collections: 1) Data on demographic characteristics, clinical characteristics, blood routine, biochemical and plasmic electrolytes and vascular imaging were collected using a questionnaire; 2) The diagnosis of renal artery FMD was based on the identification of focal or multifocal FMD lesions in at least one arterial bed by computed tomography angiography, magnetic resonance angiography and/or digital subtraction angiographies; 3) For the patients with renal artery FMD, screening was performed to assess most arteries and multivessel FMD would be collected; 4) All patients would be followed up.
7. Treatment: Standardized diagnosis and treatment procedure as recommended in the International Consensus on the diagnosis and management of fibromuscular dysplasia.
8. Follow up: 3, 6, 12 months after diagnosis and every year after enrolled.
9. Sample size estimation: About 5 hundred.
10. Timeline: Start of subjects' enrollment: Jan 2021; End of subjects enrollment: December 2026; End of study: December 2036.
11. Organization: The Centre for Epidemiological Studies and Clinical Trials, Ruijin Hospital, Shanghai, China.","1. Study name: A Prospective Study of the Renal artery fibromuscular dysplasia Registry in China
2. Rationale: Fibromuscular dysplasia (FMD) is an idiopathic systemic noninflammatory arterial disease resulting in narrowing of medium-sized arteries and causes stenosis, aneurysm, occlusion, or dissection. Renal arteries are most commonly involved vessels, although it can also affect arteries in other vascular territories. Renal artery FMD is the second frequent cause of renovascular hypertension (RVH), especially in adolescents. FMD often affects two or more arterial beds (prevalence of multivessel FMD: 57 to 66%). Despite traditional views on the role of female hormones, mechanical factors and, more recently, smoking, the pathophysiology of FMD is still not well understood. There were little Asians in the United States and the European/International FMD registry.
3. Objective: 1) To describe the characteristics of renal artery FMD in men and women, older and younger patients and according to different arterial manifestations, ethnic origin in order to individualize management and prevent complications; 2) To identify environmental/ hormonal factors and exposures (for example smoking) associated with the onset and progression of renal artery FMD;3)To identify baseline characteristics of the disease associated with an increased risk of complications such as dissections, aneurysms, stroke or myocardial infarction; 4) To provide evidence-based algorithms for the optimal management and follow-up of patients with renal artery FMD; 5) To establish a comprehensive imaging resource including a wide range of presentations of renal artery FMD, which may be used to improve knowledge and raise awareness in the medical community.
4. Study design: Prospective, multi-center, observational study.
5. Study population: patients with renal artery fibromuscular dysplasia who signed the informed consent will be eligible. The following patients are eligible for inclusion: 1) Patients with established renal artery FMD, at least one string-of-beads (multifocal FMD) or focal stenosis (focal FMD). 2) Patients with so-called ""atypical FMD"" or ""FMD-like presentation"", i.e. patients presenting with at least one dissection or 2 aneurysms \< 60-year-old, in the absence string-of-beads, focal stenosis or evidence of inherited arteriopathy. 3) Children with renal artery FMD may be also included, provided they meet the inclusion criteria and there is no evidence of underlying syndromes such as Williams syndrome, Alagille syndrome or type 1 Neurofibromatosis.
6. Data Collections: 1) Data on demographic characteristics (age, gender, height, and ethnicity), clinical characteristics \[seated office systolic and diastolic blood pressure (BP), smoking, family history on hypertension or FMD, concomitant diseases, current medications, age at diagnosis of renal artery FMD, angiographic subtype of renal artery FMD, symptoms of renal artery FMD at diagnosis and associated atheroma lesions\], blood routine, biochemical and plasmic electrolytes and vascular imaging (arterial beds explored, imaging modality, type, and site of lesions for each vascular bed) were collected using a questionnaire; 2) The diagnosis of renal artery FMD was based on the identification of focal or multifocal FMD lesions in at least one arterial bed by computed tomography angiography (CTA), magnetic resonance angiography(MRA) and/or digital subtraction angiographies (DSA), as recommended in the first international FMD Consensus; 3) For the patients with renal artery FMD, screening was performed to assess all arteries (for example: cerebrovascular, mesenteric, aorta, renal, coronary, visceral, upper and lower extremity arteries) and multivessel FMD would be collected. 4) All patients would be followed up and data ( for example: the blood pressure and restenosis) would be evaluated again.
7. Treatment: Standardized diagnosis and treatment procedure as recommended in the International Consensus on the diagnosis and management of fibromuscular dysplasia.
8. Follow up: 3, 6, 12 months after diagnosis and every year after enrolled.
9. Sample size estimation: About 5 hundred.
10. Timeline: Start of subjects' enrollment: Jan 2021; End of subjects enrollment: December 2026; End of study: December 2036.
11. Organization: The Centre for Epidemiological Studies and Clinical Trials, Ruijin Hospital, Shanghai, China.",RECRUITING,,2021-10-01,2036-12-31,2026-12-31,OBSERVATIONAL,,,,,,500,ESTIMATED
NCT03122730,VentaProst Versus Conventionally-Administered Aerosolized Epoprostenol in Patients Undergoing Cardiac Surgery With CPB,A Two-Part Pharmacodynamic Study to Compare VentaProst (Epoprostenol Solution for Inhalation Via Custom Drug Delivery System) Dosing to Conventionally Administered Aerosolized Epoprostenol Dosing in Cardiac Surgery Patients,The purpose of the Phase 2a study is to: 1) demonstrate that the estimated VentaProst dose is safe and equivalent in effect to a dose administered via epoprostenol aerosolization by the current off-label-use practice; and 2) demonstrate that an optimum effect can be rapidly obtained with VentaProst titration.,"Part I:

This part of the study is designed to demonstrate the dose equivalence between off-label aerosolized epoprostenol and VentaProst using a patient's hemodynamic parameters.

Part II:

This part of the study is designed to establish a dose response relationship of VentaProst to hemodynamic effect by dose escalation in patients who have had cardiac surgery with CPB.",COMPLETED,,2017-08-23,2019-05-30,2019-03-01,INTERVENTIONAL,PHASE2,NA,SINGLE_GROUP,NONE,TREATMENT,15,ACTUAL
NCT00174330,Comparing Amlodipine/Atorvastatin Co-Administration To Amlodipine Alone In Patients With Hypertension And Dyslipidemia,"A Multi-Center, Randomized, Open-Label Study To Evaluate Efficacy And Safety Of Dual Therapy With Atorvastatin Plus Amlodipine When Compared Amlodipine Therapy Alone In The Treatment Of Subjects With Concurrent Hyperlipidemia And Hypertension.",To evaluate efficacy of the dual therapy of atorvastatin + amlodipine vs. amlodipine alone .,,COMPLETED,,2005-05,2006-02,,INTERVENTIONAL,PHASE4,RANDOMIZED,PARALLEL,NONE,TREATMENT,330,
NCT02951130,Milrinone in Congenital Diaphragmatic Hernia,Milrinone in Congenital Diaphragmatic Hernia,"Infants with congenital diaphragmatic hernia (CDH) usually have pulmonary hypoplasia and persistent pulmonary hypertension of the newborn (PPHN) leading to hypoxemic respiratory failure (HRF). Pulmonary hypertension associated with CDH is frequently resistant to conventional pulmonary vasodilator therapy including inhaled nitric oxide (iNO). Increased pulmonary vascular resistance (PVR) can lead to right ventricular overload and dysfunction. In patients with CDH, left ventricular dysfunction, either caused by right ventricular overload or a relative underdevelopment of the left ventricle, is associated with poor prognosis. Milrinone is an intravenous inotrope and lusitrope (enhances cardiac systolic contraction and diastolic relaxation respectively) with pulmonary vasodilator properties and has been shown anecdotally to improve oxygenation in PPHN. Milrinone is commonly used during the management of CDH although no randomized trials have been performed to test its efficacy. Thirty percent of infants with CDH in the Children's Hospital Neonatal Database (CHND) and 22% of late-preterm and term infants with CDH in the Pediatrix database received milrinone. In the recently published VICI trial, 84% of patients with CDH received a vasoactive medication. In the current pilot trial, neonates with an antenatal or postnatal diagnosis of CDH will be randomized to receive milrinone or placebo to establish safety of this medication in CDH and test its efficacy in improving oxygenation.",This is a pilot trial to determine if milrinone infusion in neonates ≥ 36 weeks' postmenstrual age (PMA) at birth with CDH would lead to an increase in PaO2 with a corresponding decrease in OI by itself or in conjunction with other pulmonary vasodilators such as iNO at 24 h post-infusion.,ACTIVE_NOT_RECRUITING,,2017-10-24,2025-03-31,2024-09-30,INTERVENTIONAL,PHASE2,RANDOMIZED,PARALLEL,QUADRUPLE,TREATMENT,66,ESTIMATED
NCT05436730,"""Escape"" Phenomenon of the Antihypertensive Therapy Efficacy","The Role of Ambulatory Blood Pressure Characteristics, Features of the Structural and Functional Vascular Wall State, the Presence and Severity of Obstructive Sleep Apnea Syndrome in Predicting the ""Escape"" Phenomenon of the Antihypertensive Therapy Efficacy.","A little attention is paid to the AHT efficacy escaping problem, which can be explained by the AHT correction simplicity and rapid achievement of the target BP level. Nevertheless, modern statistic data on the effective AH treatment described above let us assume that AHT correction is either totally absent or is untimely in case of the ""escape"" phenomenon development. This could be one of the main reasons for the high prevalence of ineffective AH treatment. The aim of this study is to determine AHT efficacy ""escape"" phenomenon timeline and its predictors in hypertensive patients.",,ACTIVE_NOT_RECRUITING,,2015-09-29,2025-12-30,2016-12-30,OBSERVATIONAL,,,,,,165,ACTUAL
NCT02945930,"Study the Safety and Efficacy of ""Compont Medical Glue"" in the Treatment of Esophagogastric Varices","A Prospective Multicenter, Open Study on the Safety and Efficacy of ""Compont Medical Glue"" in the Treatment of Esophagogastric Varices",To observe the Safety and Efficacy of Compont Medical Glue in the Treatment of Esophagogastric Varices.,"""Compont Medical Glue"" is a kind of histoacryl producted by Compont Company. It has been used to treat esophagogastric varices for several years. This study is a prospective multicenter,open study on the safety and efficacy of Compont Medical Glue in the treatment of esophagogastric varices. Weather the patient receiving injection of Compont Medical Glue is according to the degree of esophageal-gastric varices and is decided by the experienced endoscopic physicians. No additional intervention will be given to the patients, no matter whether patients are participated in the study.",UNKNOWN,,2016-09,2018-11,2018-09,OBSERVATIONAL,,,,,,2200,ESTIMATED
NCT06122220,Optic Nerve Sheath Measurement and Angiogenic Factors in Patients With Pre-eclampsia.,Optic Nerve Sheath Measurement and Angiogenic Factors for the Diagnosis of Pre-eclampsia,"Hypertensive disorders of pregnancy (HPT) are an important cause of maternal-feto-neonatal morbidity and mortality, being one of the three leading causes of maternal death in our country and in developing countries. The only cure for THE is termination of pregnancy, which ends up being a decision in which gestational age and maternal risks must be balanced. Angiogenic factors have come to occupy an indispensable place in the arsenal of tools that can be used to separate the patient with a high likelihood of complications from those in whom prolongation of pregnancy could represent an important neonatal benefit. Refining the diagnostic capability of this test would further improve maternal-fetal outcomes and the use of optic nerve sheath diameter (ONSD) measurement could make the difference.

The purpose of the present study is to correlate the measurement of ONSD with serum angiogenic factor (AF) values in patients with pre-eclampsia and to determine its predictive ability for adverse perinatal outcomes.",,NOT_YET_RECRUITING,,2024-07-09,2024-09-30,2024-08-31,INTERVENTIONAL,NA,NON_RANDOMIZED,PARALLEL,NONE,DIAGNOSTIC,200,ESTIMATED
NCT04065620,Ambulatory Blood Pressure in HFPEF Outcomes Global Registry,Evaluation of Ambulatory Blood Pressure Measurement Related Hemodynamic Biomarkers On the Progression of Heart Failure With Preserved Ejection Fraction,"Heart failure and preserved ejection fraction (HFPEF) is a disease with increasing prevalence world wide. Due to its etiological and prognostic relationship with hypertension, it is highly interesting to know the characteristics and influence of Blood pressure levels and of the hemodynamic biomarkers, measured by Ambulatory Blood Pressure measurement in the outcome of patients with (HF-PEF), defined by the risk of cardiovascular morbidity and mortality (hospital re-admissions, emergency room visits, functional decline and mortality). The investigators consider other factors such as Frailty, comorbidities, and the baseline functional capacity to asses the prognostic value.","The prognosis of patients with heart failure and preserved ejection fraction (HF-PEF), defined by the risk of cardiovascular morbidity and mortality (hospital re-admissions, emergency room visits, functional decline and mortality), depends on multiple factors such as Frailty, comorbidities, BP values, hemodynamic parameters and the baseline functional capacity. Correct definition of these prognostic factors may help define more effective management strategies This is a Prospective observational cohort study, aimed to identify prognostic factors of readmission for heart failure or death in patients with HF-PEF.

Patients with stable HF-PEF will be included monitoring will be by telephone or personal interview every 3 months for at least one year.Specific data on HF will be collected directly from the patient, or from the computerized medical record, with the objective of determining different aspects of HF.

An echocardiogram performed 6 months before inclusion in the case of known HF, or up to 3 months after inclusion, will be considered valid. Parameters collected will include ejection fraction, dimensions of the atrium and ventricle and variables of diastolic dysfunction. ( The procedures for BP measurement, will be according to the ESH/ESC 2018 guidelines, All patients included in the study should have a 12 lead rest EKG performed at study inclusion. Data will be required on renal function (creatinine and glomerular filtration rate and microalbuminuria), lipid parameters (cholesterol: total, HDLc, LDLc,), baseline glucose, glycated hemoglobin (HbA1c), liver biology (GOT, GPT, GGT), albumin and prealbumin, blood cell count, Ferritin and Transferrin saturation rate, natriuretic peptides.

In some centres blood sample will be collected to a further evaluation of biomarkers.

24-hour ABPM will be made using validated devices, ABPM device should be programmed to take measurements every 30 minutes . Patients will be instructed in their use. Periods of activity and rest will be pre-determined in short windows: In addition, the duration of ABPM (hours), the percentage of valid readings, and the mean SBP/DBP values during periods of activity, rest and in 24 hours will be recorded. Records with a duration \<24 hours, those without one good reading per hour and those with \<70% of satisfactory readings will be excluded. ABPM will be performed at baseline and at the final visit HBPM should be done by a trained individual (the patient or anyone else), with equipment validated, calibrated and provided with memory.

Only validated semiautomatic oscillometric arm cuff devices are recommended for these measurements. The functional status will be determined using the Barthel index, Cognitive impairment will be tested following the Montreal Cognitive Assessment with local adaptations.

The diagnosis of frailty will be made using the Short Physical Performance Battery In a subset of centres a 24H ambulatory ECG recording will be performed using a standard recording unit and automatically analyzed by a PC-based Holter system.",UNKNOWN,,2020-03-01,2023-12-01,2022-12-01,OBSERVATIONAL,,,,,,5000,ESTIMATED
